sentence,start_time,end_time,label,certainty_score,sentiment_score
I mean I think the honest answer is that we're going to have to upgrade people's Hardware 3 computer for those that are bored full self-driving.,2796.3,2807.2,neutral,0.9993003606796265,0.0
And then is the honest answer and that's going to be painful and difficult but we'll get it done.,2807.2,2811.8,neutral,0.9984771609306335,0.0
"Now, I'm kind of glad that not that many people bought the prophecy package.",2814.3,2817.2,neutral,0.9978393316268921,0.0
"Thanks, he won.",2820.4,2821.0,positive,0.9979129433631897,0.9979129433631897
"The next question has Tesla given up on renting, their solar roof product.",2821.6,2826.5,negative,0.997161865234375,-0.997161865234375
"No, we're sorry.",2829.3,2831.6,neutral,0.970289409160614,0.0
Mike.,2831.7,2832.4,neutral,0.9988195300102234,0.0
"Oh my God, yeah.",2832.4,2833.4,negative,0.6034520864486694,-0.6034520864486694
"Oh yeah, I can take it.",2834.0,2834.8,neutral,0.977017879486084,0.0
Yeah.,2835.0,2835.2,neutral,0.9958522319793701,0.0
"Solar roof remains a core part of the residential product portfolio, and it still remains where it draws a lot of customer interest.",2835.2,2841.7,positive,0.9911353588104248,0.9911353588104248
"Despite it being premium products, we've worked on multiple iterations of engineering to make the product easier to install and distribute by the producing.",2841.7,2850.3,positive,0.9978681802749634,0.9978681802749634
"Ask you count and you know, more recently rather than direct installation, we are focused on growth through our Nationwide network of certified installers.",2850.3,2858.8,positive,0.9979198575019836,0.9979198575019836
"And many of those, they've been installing solar group with us for many years.",2859.7,2863.6,positive,0.87570720911026,0.87570720911026
That's actually turned out to be a much better way for that.,2865.7,2868.4,positive,0.9484483003616333,0.9484483003616333
"Like it is just let the roof just supply products, the roofing industry and especially when somebody's going to kiss is getting a new roof anyway or building a house from scratch.",2868.4,2878.5,neutral,0.9995265007019043,0.0
"Obviously this is by far the most efficient time to put in a solar roof as opposed to putting this whole roof on a house that where the roof still has, you know, 20 years of life that that's not economically sensible.",2878.6,2891.7,neutral,0.9967077970504761,0.0
"But but but if it's a new house, Or the leaf roof needs to be replaced.",2891.7,2896.6,neutral,0.9994829893112183,0.0
"Anyway, then solar roof can make a lot of sense and, and and it is it is a premium product.",2896.6,2905.1,neutral,0.9924322366714478,0.0
"It's like the Tesla like Model S model X or some looks like a pretty, it's a premium product.",2905.1,2910.6,neutral,0.9991838335990906,0.0
"I think it looks really cool and you're out, I mean your house generates electricity and if you combine it with the Tesla powerwall battery, then you can be self-sufficient.",2910.9,2921.5,positive,0.9919420480728149,0.9919420480728149
So even if the grid turns off even if the grits AI was off for several days.,2921.5,2925.9,neutral,0.9988786578178406,0.0
Your hostel works.,2926.3,2928.2,neutral,0.9990142583847046,0.0
And your roof looks awesome.,2929.8,2931.0,positive,0.9978156089782715,0.9978156089782715
So it's like I recommend anyone who had you can afford it.,2932.0,2935.7,neutral,0.9991551637649536,0.0
Get the Tesla solar roof and the powerwall.,2935.7,2937.4,neutral,0.9965544939041138,0.0
"You're the only life might depend on it, get enough.",2939.1,2941.6,neutral,0.998275876045227,0.0
"And and just just in terms of convenience, you know, your kids are not going to yell at you because their computers, don't work because the power went out and there and you can charge your phone first week.",2941.6,2951.1,neutral,0.997199296951294,0.0
Actually happens to.,2951.6,2952.7,neutral,0.9987391829490662,0.0
Yeah.,2956.7,2957.1,neutral,0.9958522319793701,0.0
Thank you very much.,2962.3,2963.0,neutral,0.9990378618240356,0.0
The next question was covered in opening remarks so we will skip that.,2963.6,2967.7,neutral,0.9996132254600525,0.0
"And the last question from say.com, what technical breakthroughs will Define the 14 of FSD given that the 13 already covered, Photon to confirm all Well we're going to have a look but will help improve and photons to Upward.",2968.0,2985.7,neutral,0.9975207448005676,0.0
"We've been in sort of the nothing but dance situation, nothing but neural Nets from photons to controls for a while now for just improving the neural net I guess we could get into Technical details.",2987.6,3001.0,neutral,0.9990247488021851,0.0
"Some degree have to say, I continue to be amazed by just how effective order aggressive Transformers, are at solving, a wide range of problems.",3001.0,3012.6,positive,0.997148334980011,0.997148334980011
"I'm going to show you is then it if you'd like to add there without giving away the sort of family secrets except for things, we photonics already as a continue to scale the model size lat you know, we scale bunch of e-13 but then there's still room to grow.",3014.1,3029.2,positive,0.8388451933860779,0.8388451933860779
So we're going to continue to scale.,3029.5,3030.5,positive,0.9982688426971436,0.9982688426971436
The water sighs.,3030.5,3031.5,neutral,0.9624761343002319,0.0
"You're going to increase the context length, even more the memory sort of like limited right now, we only increase the amount of memory also gave to even minutes of context for driving.",3031.8,3042.0,positive,0.9971319437026978,0.9971319437026978
We're going to add audio.,3042.1,3043.7,neutral,0.9986818432807922,0.0
He owed and emergency vehicles better at like data of the tricky Corner cases that we get from the entire fleet.,3043.9,3050.0,positive,0.996436595916748,0.996436595916748
"You know, any interventions for any kind of plug in a user intervention.",3050.0,3053.1,neutral,0.9992732405662537,0.0
"We said that to the data, the data set, so scaling in basically every access to Clinic compute, its size model, size model context.",3053.1,3062.9,neutral,0.9995797276496887,0.0
"And also all the reinforcement learning objectives, Already with that.",3062.9,3069.8,neutral,0.9975918531417847,0.0
"We will move over to analysts questions so just as a reminder, you will need to unmute yourself to ask your question.",3069.8,3078.1,neutral,0.9995310306549072,0.0
And the first question will be coming from Daniel rosca.,3078.1,3080.8,neutral,0.9994670748710632,0.0
From Bernstein Daniel.,3080.9,3083.2,neutral,0.9983453750610352,0.0
Please go ahead and unmute yourself.,3083.2,3085.3,neutral,0.9994552731513977,0.0
"Hey, good evening everybody.",3085.9,3086.8,neutral,0.9992333650588989,0.0
"It's Daniel for Bernstein, Elon Tesla, share price.",3086.8,3090.1,neutral,0.9995317459106445,0.0
Clearly already includes quite a few of the anticipated benefits.,3090.1,3093.3,positive,0.9818080067634583,0.9818080067634583
You talked about today yet realizing what you call kind of But achievable will take some time.,3093.3,3099.5,neutral,0.9978610873222351,0.0
"What are you pushing the Tesla executive team to do differently now to accelerate the innovation in order to realize the value, you described for the company?",3100.4,3109.4,positive,0.9932771325111389,0.9932771325111389
"well, I mean we're Working on perfecting real world AI think and making rapid progress week of a week if not more, you know.",3113.8,3124.0,positive,0.9981683492660522,0.9981683492660522
So the amount of a month it's often week over week.,3124.0,3126.2,neutral,0.9995017051696777,0.0
"I spent a lot of time with the Tesla, ai ai team and the Tells Optimus team at then I go with a problem is essentially like not, you know, if something was, you know, portion sometimes like don't talk to Tesla executive Mike AI.",3129.7,3142.8,neutral,0.999495267868042,0.0
"We don't see very often and I'm like, that's because your stuff is working.",3142.8,3145.0,neutral,0.9991942048072815,0.0
Awesome yourself working with your great.,3145.0,3148.2,positive,0.9926515221595764,0.9926515221595764
"Unfortunately, I didn't see them very often because I go where the bomb is.",3148.4,3151.3,negative,0.9682002663612366,-0.9682002663612366
"So, I promise, we're like, what's the, what's the greatest challenge that lies ahead?",3151.5,3158.6,neutral,0.9638837575912476,0.0
"So, obviously, there's this, there are many challenges with Optimus, it's a hard problem to solve many challenges will check with the vehicle autonomy, but we're making rapid progress in both.",3158.6,3172.2,negative,0.9762287735939026,-0.9762287735939026
Yeah.,3176.7,3177.1,neutral,0.9958522319793701,0.0
Okay.,3179.4,3179.8,neutral,0.9685479998588562,0.0
I mean sounds like you you've got a conviction that the pieces you need.,3180.1,3184.5,neutral,0.993791401386261,0.0
Right?,3184.6,3185.0,neutral,0.9981926083564758,0.0
Are are in place.,3185.0,3186.3,positive,0.9659935832023621,0.9659935832023621
Yeah.,3186.7,3187.0,neutral,0.9958522319793701,0.0
If we kind of go 12 months down the line and we look back and you had some of those but maybe what are the kind of two or three?,3187.4,3194.1,neutral,0.9995418787002563,0.0
"Kpis, that would tell you, that, you know, you're on track and it's going the right way, and the pieces you put in place.",3194.1,3201.3,neutral,0.9600289463996887,0.0
"Are the right pieces, right?",3201.3,3202.2,neutral,0.9994475245475769,0.0
That's kind of what I'm looking for or other way.,3202.2,3206.0,neutral,0.9994269609451294,0.0
Round.,3206.2,3206.7,neutral,0.995016872882843,0.0
Where would it be off?,3207.7,3208.9,neutral,0.9994152784347534,0.0
Most likely in your mind that you say hey I need to go back there and I need to change something to enable the team better.,3208.9,3214.6,neutral,0.9995799660682678,0.0
"Well, I mean I think my prediction is that I'm making here are going to be pretty accurate.",3218.3,3224.1,positive,0.9581623673439026,0.9581623673439026
"Yeah, and it's with an echo, so sometimes feels AI know your lines always late.",3225.5,3229.7,neutral,0.9942208528518677,0.0
"Well, actually no, the problem is that the media reports on when I'm late but never works when I'm really so sure I'm optimistic, but I'm not that optimistic, you know, there are many cases in past where I actually would have been early you know such as completion of the Shanghai Factory or fragrance Factory gigafactory completion is generally been ahead of schedule, not behind.",3229.7,3251.8,neutral,0.5458714365959167,0.0
"So Yeah, so the but I like so I'm very confident.",3251.8,3262.2,positive,0.9983217120170593,0.9983217120170593
We will have released on 2 players full self-driving.,3262.2,3265.4,positive,0.9927652478218079,0.9927652478218079
Fully autonomous Tesla has in Austin and several other cities in America by the end of this year as probably everywhere in America next year at everywhere.,3265.4,3278.3,neutral,0.979128360748291,0.0
"North America, at least, I think, in terms of next year, our constraints and I think it's likely to be just regulatory, you know, like the Q4 Europe really has.",3278.3,3288.4,negative,0.5959956049919128,-0.5959956049919128
"For example, Europe is layer cake of regulations and bureaucracy, which really needs to be addressed.",3288.4,3294.8,neutral,0.9994694590568542,0.0
There's this A drug like America innovates Europe.,3296.4,3301.7,neutral,0.9993491768836975,0.0
"Regulates, so guys, this too many reps on the field.",3301.7,3306.2,neutral,0.6803556680679321,0.0
"Any, for example, for us to just to release and just release supervised, full self-driving in Europe, even though it works really well.",3307.9,3314.2,negative,0.8234180212020874,-0.8234180212020874
"We have to go through a mountain of paperwork with the Netherlands, which is our primary regulatory Authority, then the Netherlands presents this to the EU.",3314.6,3325.8,neutral,0.9993916749954224,0.0
And I think May And there's like this big EU country committee.,3325.8,3332.1,neutral,0.9994613528251648,0.0
We expected to be approved at that time.,3332.7,3335.3,positive,0.9980613589286804,0.9980613589286804
But there's nothing we can do to make that may happen soon enough.,3335.5,3338.5,negative,0.9950202703475952,-0.9950202703475952
"In fact, nobody seems to do if that I guess all the countries would have to somehow vote in some way to have it happen sooner than May Otherwise, we weren't having children me.",3339.4,3352.1,neutral,0.9993175268173218,0.0
So then we will then when is unsupervised ever?,3353.6,3356.7,neutral,0.9995508790016174,0.0
See a lot in Europe on Mike Maybe next year.,3356.7,3360.2,neutral,0.9991348385810852,0.0
"Maybe, I don't know where to find out when you use me again.",3360.2,3365.8,negative,0.919321596622467,-0.919321596622467
"Sometimes it's a 12-month, Cadence, sometimes a six-month Cadence then China, which is a huge margins.",3367.0,3374.3,neutral,0.9304171204566956,0.0
Gigantic Market.,3374.3,3374.9,neutral,0.9945375323295593,0.0
We do have some challenges because they weren't currently allow us to transfer training video outside of China and then the US government won't let us do training in China.,3374.9,3386.0,negative,0.9987128973007202,-0.9987128973007202
So we're in a bit of a bind there.,3386.3,3387.4,negative,0.998766303062439,-0.998766303062439
"Said it, like, whatever quandary.",3389.8,3392.5,neutral,0.9994588494300842,0.0
"So we already solving that is, by literally, looking at videos of streets in China that are available on the internet to understand and then feeding that into our video training so that publicly available video of street signs and traffic rules in.",3392.6,3414.4,neutral,0.9994118213653564,0.0
China can be can be used for training.,3414.4,3418.7,neutral,0.9990730285644531,0.0
And then also putting it in a good recovery accurate simulator.,3419.9,3424.4,neutral,0.9742164015769958,0.0
"And and so it will train using some for, you know, bus lanes, and try and like bus lanes and China.",3425.0,3430.4,neutral,0.757153332233429,0.0
"By the way, what about the biggest challenges in making FSD working?",3430.4,3437.1,neutral,0.9724535346031189,0.0
Try and is the bus lanes?,3437.1,3438.5,neutral,0.999354898929596,0.0
"Are very complicated and there's like, literally, like hours of the day that you're allowed to be there and not be there.",3438.5,3444.5,neutral,0.9994674324989319,0.0
"And then, if you accidentally go in a bus lane, at the wrong time, the the you get it.",3444.5,3449.1,neutral,0.9985191226005554,0.0
Automatic ticket instantly.,3449.3,3450.5,positive,0.7818928956985474,0.7818928956985474
So there's kind of a big deal bus lanes in China.,3451.4,3454.9,neutral,0.9987969398498535,0.0
So we have put that into our Simulator train on that.,3455.6,3459.6,neutral,0.9993376135826111,0.0
The car has to know what time of day.,3460.2,3461.4,neutral,0.9995170831680298,0.0
It is read the sign better.,3461.4,3464.5,positive,0.9716504216194153,0.9716504216194153
"It will get the solved, but I think we'll have unsupervised FSD in almost every Market this year, limited simply by regulatory issues, not technical capability.",3464.5,3483.3,neutral,0.9851158261299133,0.0
Okay.,3484.9,3485.1,neutral,0.9685479998588562,0.0
"And then then unsupervised FSD in the US this year, in many cities, but Nationwide next year and and hopefully we have unsupervised FSD in most countries by the end of next year.",3485.2,3499.1,positive,0.820122480392456,0.820122480392456
That's the best.,3499.3,3501.1,neutral,0.99918133020401,0.0
My prediction with best data that I have right now.,3501.1,3503.3,neutral,0.9994899034500122,0.0
"Great, thank you very much.",3505.1,3506.4,neutral,0.9983844757080078,0.0
The next question will come from Adam Jonas at Morgan Stanley.,3506.7,3510.1,neutral,0.9994980096817017,0.0
"Adam, please feel free to unmute yourself.",3510.5,3512.4,neutral,0.9994364380836487,0.0
Thanks everybody.,3514.0,3514.9,neutral,0.9992658495903015,0.0
"So he Lon you've said in the past about lidar for a positively that lidar is a crutch, a Fool's errand.",3515.0,3523.4,negative,0.8342000246047974,-0.8342000246047974
"I think you even told me once, even if it was free and say you wouldn't use it, you still feel that way.",3523.4,3528.4,negative,0.9932464361190796,-0.9932464361190796
Yes.,3529.0,3529.4,neutral,0.9881481528282166,0.0
Care to elaborate or just another question.,3531.8,3534.8,neutral,0.9992586970329285,0.0
"Look, we even have a radar in the corner.",3536.6,3538.0,positive,0.9270122647285461,0.9270122647285461
We turned it off.,3538.0,3538.7,neutral,0.587965726852417,0.0
I got it.,3541.5,3542.0,positive,0.9765938520431519,0.9765938520431519
All right so here's bill.,3542.4,3543.6,neutral,0.9993835687637329,0.0
"Yeah, people think you're crazy you know but for not look like humans drive without shooting lasers out of their eyes English.",3543.9,3555.4,negative,0.9886960983276367,-0.9886960983276367
"You're Superman, you know but like humans drive just with passive visual dreams drivers with eyes and a neural net and a rainy roll, man.",3555.4,3566.0,neutral,0.9994699358940125,0.0
So sort of biological chemical which of the so the digital equivalent of eyes and a brain.,3566.2,3570.9,neutral,0.9995334148406982,0.0
Our cameras and and digital neural Nets are AI.,3571.2,3575.6,neutral,0.9995108842849731,0.0
So that's the entire Road system was designed for Passive Optical neural Nets.,3575.6,3582.6,neutral,0.9989996552467346,0.0
"That's how the horse that wrote system was not designed and what everyone is expecting, other Cloud.",3582.8,3587.6,neutral,0.9621244072914124,0.0
That's all we expect other close to behave.,3587.6,3589.3,neutral,0.9994816184043884,0.0
So therefore that is very obviously the solution for full self-driving in it as a generalized for the generalized solution for full self-driving.,3589.4,3598.8,neutral,0.9995695948600769,0.0
"Very specific neighborhood by neighborhood solution, which vertical to maintain, which is what our competitors are doing.",3600.0,3605.8,neutral,0.9988711476325989,0.0
I got that.,3610.1,3610.5,neutral,0.9516652226448059,0.0
"Yeah, I mean, either doesn't work in The Fall.",3610.9,3614.4,neutral,0.712874710559845,0.0
"Guys, neither has a lot of issues like like AI.",3614.6,3618.1,neutral,0.9982265830039978,0.0
"Don't have something like that SpaceX Dragon docks with the space station using lidar that a program that I personally spearheaded, I don't have some fundamental bizarre dislike.",3618.1,3629.7,neutral,0.9986867308616638,0.0
The lidar is simply the wrong solution for driving car loan roads.,3629.7,3633.7,negative,0.9968235492706299,-0.9968235492706299
Right?,3633.7,3634.4,neutral,0.9981926083564758,0.0
You understand how lidar works?,3634.4,3636.4,neutral,0.9994155168533325,0.0
I guess definitely designed and built our own.,3636.4,3639.5,neutral,0.9995026588439941,0.0
Red lidar.,3639.7,3640.7,neutral,0.9993876218795776,0.0
I oversaw the project.,3640.8,3642.3,neutral,0.9992483258247375,0.0
There's anything.,3642.3,3643.2,neutral,0.984889566898346,0.0
It was my decision to use later on dragon and I was saw the that that engineering project directly.,3644.1,3650.0,neutral,0.9995073080062866,0.0
So I'm like we looked really designed made a rata relied on the doctor space station.,3650.4,3655.8,neutral,0.9993120431900024,0.0
If I thought it was the right solution for cars I would do that but it isn't.,3655.9,3658.7,negative,0.8761829733848572,-0.8761829733848572
"Yeah all right just as a follow-up at CES you said I'm paraphrasing, the any AI will be able to do any cognitive tasks not involving atoms.",3659.3,3669.6,neutral,0.9994943141937256,0.0
Within the next three or four years.,3670.1,3671.6,neutral,0.9993368983268738,0.0
And that would imply.,3671.6,3672.4,neutral,0.9990991353988647,0.0
Elon that.,3672.4,3672.9,neutral,0.9979209303855896,0.0
"Before the end of President, Trump's term in office, that AI would be moving pretty damn quickly into the physical world, or the world of photons and atoms, and I'm thinking given your work with the administration.",3672.9,3684.8,neutral,0.983073890209198,0.0
"How confident are you that the US has, will have the manufacturing in the supply base to make good on your excitement about physical AI by the, you know, end of bilateral, this decade.",3684.8,3697.9,positive,0.9927908182144165,0.9927908182144165
We've seen pretty vulnerable right now.,3697.9,3699.2,negative,0.9989699125289917,-0.9989699125289917
"I've seen You Tweeting about or sorry, Xing, excuse me, Elon about China, for audience, live about China, having like making more drones in a day than the u.s. makes in a year and all the entanglement of the supply.",3699.2,3712.2,neutral,0.9988788962364197,0.0
So what has to happen in the u.s. to make that possible?,3712.2,3715.4,neutral,0.9994590878486633,0.0
What's your message?,3715.4,3716.4,neutral,0.9994087219238281,0.0
"And what can, what can you do about it?",3716.4,3719.3,neutral,0.9960118532180786,0.0
"And what's relevant for Tesla shareholders, thanks a lot.",3719.3,3721.9,neutral,0.9994791150093079,0.0
"Well, a Tesla obviously we think manufacturing is cool SpaceX.",3723.5,3727.5,positive,0.5006814002990723,0.5006814002990723
"We think manufacturing is cool, but in general, for talented Americans they need to go beyond, you know, my young mind companies found me at end of people in my teams here in general.",3727.5,3741.4,neutral,0.9994872808456421,0.0
We need to make many factoring bulla game in America and you know like honestly think people should move from like law and finance huge manufacturing.,3741.4,3750.9,neutral,0.9995909333229065,0.0
That's why I'm spending we've This is both a compliment in the criticism.,3750.9,3755.8,neutral,0.9022532105445862,0.0
We have too much talent in law and Engineering law and Finance in America and there should be more of that talented in many veteran.,3755.8,3761.9,neutral,0.9842177629470825,0.0
"So, Yeah.",3763.8,3769.2,neutral,0.998994767665863,0.0
"I mean, at Tesla, we're making sure that we can continue to make sure our stuff even in the event of geopolitical tensions, rising to very high levels.",3773.6,3786.0,positive,0.9940506815910339,0.9940506815910339
"Okay, thank you very much.",3788.3,3790.1,neutral,0.9987035989761353,0.0
The next question will come from Pierre.,3790.9,3792.6,neutral,0.9994761347770691,0.0
Fair.,3792.6,3792.9,positive,0.9158697128295898,0.9158697128295898
Goo New Street Pierre.,3792.9,3795.8,neutral,0.9981274008750916,0.0
Please.,3795.8,3796.0,neutral,0.9981942772865295,0.0
Feel free to unmute yourself.,3796.0,3797.1,neutral,0.9992142915725708,0.0
"Hey thanks guys, I'll taking the question.",3799.2,3801.2,neutral,0.9993757605552673,0.0
"So I have a question, you know, on deploying like robotaxi Xin, Jun in Austin so that's great news and I was wondering if it means I can you know drive down to Austin in June and try and try and so paralyzed by myself is my God.",3802.2,3819.7,neutral,0.951908528804779,0.0
So it's going to be more like Your fleets testing it.,3819.7,3824.4,neutral,0.9995494484901428,0.0
"It'll be our Fleet, testing it.",3826.1,3828.2,neutral,0.9993854761123657,0.0
"That's how sort of toe in the water, you know, would be scrutinizing.",3829.6,3833.6,neutral,0.99947589635849,0.0
It very carefully.,3833.6,3834.5,neutral,0.7581222653388977,0.0
"Make sure was also something we missed, but it will be, you know, right.",3835.0,3841.4,neutral,0.9345875978469849,0.0
"I'm trying to his right healing for money and in Austin and June and then as swiftly as possible other cities in America and I expect us to be operating a drink on AI to advise activity with with, with our internal Fleet in several studies by the end of the year, then, as probably next year, when people are are able to add or subtract their car from the fleet.",3841.9,3870.3,positive,0.9955852031707764,0.9955852031707764
"So here, come on Airbnb.",3870.5,3872.8,neutral,0.9986979961395264,0.0
Where you can sort of add or subtract your house or guest room?,3872.8,3875.9,neutral,0.999305248260498,0.0
"You know, he's like attitude and Airbnb inventory, or do data to them being be a ettore.",3876.1,3883.7,neutral,0.999497652053833,0.0
"you know, if you're traveling for a month, you can Or whatever the case may be, you can let other people use your house and then in research like that's probably a Q4.",3885.9,3899.9,neutral,0.9993866682052612,0.0
Because we want to just make sure if ironed out AI any tanks and a lot of it is it's not like we're not splitting the atom here.,3900.0,3907.5,positive,0.5181363224983215,0.5181363224983215
It's just a bunch of work that needs to be done to make sure the whole thing works efficiently that people can order the car.,3907.5,3913.4,neutral,0.9995235204696655,0.0
It comes to the right spot is exactly right thing.,3913.7,3918.9,neutral,0.9809538125991821,0.0
All the payment systems work.,3918.9,3920.7,neutral,0.9992395639419556,0.0
The billing works.,3920.9,3922.1,neutral,0.9988647699356079,0.0
Yeah.,3925.2,3925.6,neutral,0.9958522319793701,0.0
Okay.,3926.6,3927.0,neutral,0.9685479998588562,0.0
"But then like so my first question would be, you know, I have a Tesla AI, have it as D and I have to keep my eyes on the, on the road all the time.",3928.8,3937.2,neutral,0.9994757771492004,0.0
It's super boring because I don't really need to intervene anymore.,3937.2,3940.8,negative,0.9950169920921326,-0.9950169920921326
And the really annoying thing is that I can't just check my emails.,3940.8,3948.1,negative,0.9945394396781921,-0.9945394396781921
