sentence,start_time,end_time,label,certainty_score,sentiment_score
"And so are you working also on introducing, you know, like a kind of like three and supervised where where I could be eyes of and and I would be able to check my email and we just need to with a five-second noticed, have to go back and keep an eye on what's happening or is that something you're working on as well?",3948.1,3966.2,neutral,0.9989068508148193,0.0
Because it feels so close.,3966.2,3968.2,neutral,0.9641271233558655,0.0
We be certain that I wonder if it's something.,3968.2,3970.9,neutral,0.9979742169380188,0.0
We can expect for this year.,3970.9,3971.9,neutral,0.9975904226303101,0.0
It's very selfish question.,3971.9,3972.9,neutral,0.8039124011993408,0.0
"I asked for my son's, to be honest.",3972.9,3974.3,neutral,0.9960455298423767,0.0
"Yes, we just need, we need to be very confident that the probability of injury is low before we are people to check back Che Guevara be male and text messages.",3975.3,3987.0,neutral,0.9993578791618347,0.0
If I'm right now we're in this perverse situation which we have encountered yourself where people actually go to manual.,3987.6,3994.7,negative,0.9986469149589539,-0.9986469149589539
Driving to check your text messages.,3994.7,3997.4,positive,0.5114892721176147,0.5114892721176147
Yep.,3997.4,3997.8,neutral,0.9972676038742065,0.0
So the computer doesn't yell at them and and then go then put it back on autonomous mode.,3998.4,4003.8,neutral,0.9893024563789368,0.0
Once they've checked the Tesla text messages which is obviously less safe significantly mustn't.,4003.8,4010.0,neutral,0.9993109703063965,0.0
Forget me with safe.,4010.0,4011.3,neutral,0.9946997165679932,0.0
Significantly less same but just letting people I'll check their texts once in a while without the computer yelling at them Redfoo.,4011.3,4019.6,neutral,0.9981655478477478,0.0
"Just want to be cautious about that at the a to that we're in this sort of, you know, neither here nor there but just for AI, think it's not for many months longer.",4019.6,4029.8,neutral,0.9991034865379333,0.0
"But yeah, we're in the, in this perverse situation will be will turn the car off autopilot, so we can hear doesn't help them.",4032.6,4038.0,negative,0.9967779517173767,-0.9967779517173767
Check the Tesla text messages.,4038.0,4039.3,neutral,0.9989898800849915,0.0
"Well, well steering, the car with your knee and not looking out the window.",4039.3,4042.8,neutral,0.9995379447937012,0.0
"Like, like, you know, if you have any problems with the system and when people are not looking, that is a dangerous.",4042.8,4056.1,negative,0.9861183166503906,-0.9861183166503906
And that's what we're trying to avoid.,4056.1,4057.9,positive,0.9252763390541077,0.9252763390541077
It's the community is getting there but it's not fully there.,4058.2,4061.9,negative,0.9539047479629517,-0.9539047479629517
That's right.,4062.4,4063.0,neutral,0.9989393353462219,0.0
He was using the double dipping a toe in the water then getting comfortable then together.,4063.2,4068.6,neutral,0.999354898929596,0.0
"Anyway, it's not far off.",4070.4,4072.2,neutral,0.9993839263916016,0.0
"but we wouldn't want to prove to ourselves the Improvement, proved ourselves and obviously prove to Regulators that the car is unequivocally safer in autonomous mode, then they're not and that's we're not far off.",4075.0,4093.7,neutral,0.9580180048942566,0.0
So would look at this is like low single-digit months.,4093.8,4097.3,neutral,0.9992803931236267,0.0
To the safety aspect.,4098.2,4099.6,neutral,0.9990332126617432,0.0
We did Publishers safety vehicle.,4099.6,4101.8,positive,0.971486508846283,0.971486508846283
"Safety report today, and in Q4, was one crash for every five point.",4101.8,4106.0,negative,0.9899500608444214,-0.9899500608444214
"Nine million miles driven, compared to a crash over 700,000 miles without Palm Pilot.",4106.0,4111.3,positive,0.9957310557365417,0.9957310557365417
We're running circles.,4111.3,4111.9,positive,0.9962395429611206,0.9962395429611206
"Guess we're getting to the point where it's an order of magnitude events like 8.5 X, signaling.",4111.9,4117.0,neutral,0.9993777275085449,0.0
"And so, it's just about there.",4117.0,4117.9,neutral,0.9994478821754456,0.0
"Yeah, it's amazing.",4117.9,4118.9,positive,0.9976922273635864,0.9976922273635864
Great Authority.,4120.5,4121.5,neutral,0.9936521053314209,0.0
And our last question will be coming from Dan Levi at Barclays.,4121.5,4126.4,neutral,0.9994885921478271,0.0
"And Dan, feel free to unmute yourself.",4126.4,4128.3,neutral,0.9994040727615356,0.0
Hungry.,4129.3,4129.9,neutral,0.966053307056427,0.0
Good evening.,4130.4,4130.8,neutral,0.9989633560180664,0.0
Thank you for taking other questions you want.,4130.8,4134.4,neutral,0.9993441700935364,0.0
"You talked about the need for proliferation of sustainable transport in the past, as part of a sort of broader push to sustainable energy.",4134.4,4142.4,neutral,0.9963202476501465,0.0
"Oh God, I don't know.",4143.4,4144.1,negative,0.9951808452606201,-0.9951808452606201
We've heard a lot about President Obama's plans to reverse the Ed mandate and I think there's a view that given regulation is a driver CD up.,4144.1,4153.7,negative,0.986887514591217,-0.986887514591217
Take this could slow EV uptake in the u.s. so what would be your view?,4153.7,4158.6,negative,0.9983398914337158,-0.9983398914337158
View on the right policy in the US.,4158.7,4162.4,neutral,0.9992579817771912,0.0
Given your comments in the past of the need to push for sustainable transport.,4162.7,4168.4,positive,0.8540319204330444,0.8540319204330444
"You know, this point, I think the that's sustainable transport is inevitable, I'm highly confident.",4172.2,4180.4,positive,0.9972289204597473,0.9972289204597473
"All Transport will be autonomous electric, including aircraft and that it's simply, it's it can't be stopped anymore than one could have stopped.",4181.2,4192.5,neutral,0.997795581817627,0.0
"The Advent of the external combustion, engine steam engine or, or one could have stopped the at me.",4192.5,4199.9,neutral,0.9964633584022522,0.0
The internal combustion engine.,4200.0,4201.3,neutral,0.9993314743041992,0.0
"Like you can, if you've been the biggest Force Advocate that on Earth, he liked it.",4202.8,4207.2,positive,0.8525718450546265,0.8525718450546265
Like a horse's of the way.,4207.2,4210.1,neutral,0.9994469285011292,0.0
Don't these newfangled car automobiles?,4210.5,4213.1,neutral,0.9988896250724792,0.0
The you can't stop.,4214.1,4215.3,negative,0.99425208568573,-0.99425208568573
They have into going with y'all.,4215.3,4216.5,positive,0.8187419176101685,0.8187419176101685
It's going to happen.,4216.9,4217.7,neutral,0.9861885905265808,0.0
"And you can't, you can't stop the Advent of electric cars, it's going to happen.",4219.3,4223.9,negative,0.8316776156425476,-0.8316776156425476
"The only thing holding back, electric cars was range and that is a solved problem.",4225.0,4228.7,positive,0.7460260391235352,0.7460260391235352
Great.,4233.0,4233.4,positive,0.9974786639213562,0.9974786639213562
"And then as a follow up, you know, in the past deal on you and made a comment that you know you'd be willing to sell cars that effectively no margins, get the cars out there and there's a comment in the release today of the rate of acceleration of autonomy efforts, does impact volume growth.",4235.4,4253.8,neutral,0.6143729090690613,0.0
"So perhaps you could just talk about, you know, with your efforts on FSD how we should think about yours.",4253.8,4262.7,neutral,0.9995373487472534,0.0
"Desire to put more Vehicles out in the market, to take advantage of your of your Tech advances.",4262.8,4270.2,positive,0.9976820945739746,0.9976820945739746
So I'm not sure.,4273.3,4273.7,negative,0.9874217510223389,-0.9874217510223389
"I understand the question, we have a lot of cars and you've got millions of cars out.",4273.7,4277.9,neutral,0.9988061189651489,0.0
There is your question done that.,4277.9,4282.2,neutral,0.9989935755729675,0.0
"How do we, how do we marry our future growth aspects with FSD?",4282.5,4287.6,neutral,0.9752627015113831,0.0
Get going to meet yourself down.,4290.1,4291.7,neutral,0.996615469455719,0.0
Yeah more.,4294.3,4295.5,neutral,0.9988879561424255,0.0
"So just how much more aggressively you would be wish it willing to, you know, sell your cars versus versus, you know, in light of your of your improvements on that Dusty.",4295.5,4307.4,neutral,0.9931282997131348,0.0
AI.,4308.1,4308.1,neutral,0.9984643459320068,0.0
"Well, right now, the constraint we're trying to solve is battery production as opposed to demand.",4310.3,4317.6,neutral,0.9993517994880676,0.0
So you're and now q1.,4317.6,4321.6,neutral,0.9994633793830872,0.0
"We've got this massive factory retooling for the new model y, for example, and obviously inventory has a short-term impact on awkward, but the followers thing was, in fact, we're talking the, the executive team and I were talking about just before this call was from gotta figure out how How to increase total giggling hours of battery production this year, one way or another, that's the constraint on our output.",4321.6,4348.4,neutral,0.997269332408905,0.0
Already.,4352.5,4353.0,positive,0.562290370464325,0.562290370464325
"And with that, I think we are all done for today.",4353.0,4356.5,neutral,0.9993909597396851,0.0
So thanks everyone so much for all your questions.,4356.6,4359.0,neutral,0.9994555115699768,0.0
We look forward to talking to you next quarter.,4359.0,4360.9,neutral,0.99955815076828,0.0
They very much and goodbye.,4361.3,4362.3,neutral,0.9974789023399353,0.0
